{
  "schemaVersion": "ofarm.lossmap.v0.1",
  "lossMapId": "lossmap:isoxml-import:v1",
  "mappingCoverageStatementRef": "mapping-coverage:isoxml-import:v1",
  "overallLossPosture": "MATERIAL",
  "lossItems": [
    {
      "externalConstructRef": "ISOXML vendor extension blocks",
      "lossClass": "UNREPRESENTABLE",
      "impactLevel": "HIGH",
      "downstreamRisk": "Vendor-specific agronomic or machine detail may not survive ingest into governed OFARM semantics.",
      "requiresGovernanceOnHighConsequenceUse": true,
      "mitigation": "Retain original file as durable evidence and keep trace from normalized claims back to the source artifact."
    },
    {
      "externalConstructRef": "Task controller execution status detail",
      "ofarmTargetRef": "operation claim execution qualifiers",
      "lossClass": "APPROXIMATED",
      "impactLevel": "MEDIUM",
      "downstreamRisk": "Fine-grained machine status codes may collapse into a smaller OFARM execution-state vocabulary.",
      "requiresGovernanceOnHighConsequenceUse": false,
      "mitigation": "Preserve the raw source payload and expose the approximation class in the mapping trace."
    },
    {
      "externalConstructRef": "timezone-ambiguous timestamps in legacy task records",
      "ofarmTargetRef": "event time / evidence time",
      "lossClass": "ASSUMED",
      "impactLevel": "HIGH",
      "downstreamRisk": "Ambiguous time normalization can affect sequencing or current-state interpretation.",
      "requiresGovernanceOnHighConsequenceUse": true,
      "mitigation": "Require explicit normalization policy and flag downstream materializations as requiring review where policy demands it."
    }
  ],
  "notes": "Illustrative loss posture for ISOXML import where raw files remain attached as evidence."
}
